{"schemaVersion":1,"id":"bounded-tools-only","pairId":"bounded-content-raw","mode":"tools-only","developerPrompt":"Inspect imported trace trace-repeated-search-content. Traverse its bounded semantic content and use raw bytes only for the explicit parser-forensics comparison.","fixtures":[{"path":"loomspan-console-fixtures/traces/repeated-search-content.ndjson","sha256":"a39360c6b1b2e89ddc069611f46d13b527ae2a544de443ec1f48ef1ab89b6703"}],"allowedTools":["LOOMSPAN_get_runtime","LOOMSPAN_list_skills","LOOMSPAN_get_skill","LOOMSPAN_list_executions","LOOMSPAN_get_execution","LOOMSPAN_get_execution_activity","LOOMSPAN_list_traces","LOOMSPAN_get_trace","LOOMSPAN_query_trace_plans","LOOMSPAN_query_trace_frames","LOOMSPAN_query_trace_records","LOOMSPAN_read_trace_content","LOOMSPAN_read_trace_artifact"],"requiredFacts":["traceId selection","complete continuation traversal","descriptor inline and exact content roles","deliberate raw forensics"],"requiredLimitations":["client externalization is not evidence loss","raw bytes are not the ordinary semantic view"],"forbiddenClaims":["raw bytes are the preferred workflow","externalization means Console lost evidence"],"forbiddenActions":["shell","filesystem","browser"]}
