{"schemaVersion":1,"id":"live-skill-assisted","pairId":"live-concurrency","mode":"skill-assisted","developerPrompt":"Inspect the active executions and explain which branches are concurrently active without inferring cause.","fixtures":[{"path":"loomspan-console/browser-fixtures/active-executions/concurrent-siblings.json","sha256":"69fde84297ff6a0244a3971443af4cce26f3997dd8706665aa02e397a98f4821"},{"path":"loomspan-console/browser-fixtures/active-executions/grouped-disabled.json","sha256":"0bd37e2964f8ca292485382df47b2052c240b7c8a8597975cab115a07a8c4aef"},{"path":"loomspan-console/browser-fixtures/active-executions/nested-inheritance.json","sha256":"18517722f27d7b23a270bb81fb3c616ed8a8606bc02063a8655c04f7e06f72c3"},{"path":"loomspan-console/browser-fixtures/active-executions/nested-shadowing.json","sha256":"9323ee14c9e5318223e1ad35f1f566d0cf30dd903682fe6ad6f9463c1208d6a8"},{"path":"loomspan-console/browser-fixtures/active-executions/serial-assigned.json","sha256":"87201a13555b646700d9fef6831f557deb4da71faa9d6debe8a389d43e8c3e9b"},{"path":"loomspan-console/browser-fixtures/active-executions/unassigned.json","sha256":"614ece09c1a329f1e04ad997307989b1f3f29fff464b16c1278add1ef9e2072c"},{"path":"loomspan-console/browser-fixtures/active-executions/equal-group-different-plans.json","sha256":"eaa0a7aa4338c5330372297f977be6aa7c31b2beb9716da7e8e4be9d74d89adf"},{"path":"loomspan-console/browser-fixtures/active-executions/repeated-task-leaves.json","sha256":"67d9ba2b517a8a86a4f7f307ce0c5aafd89e662ceaff464753f0ef405cc1c83d"}],"allowedTools":["LOOMSPAN_get_runtime","LOOMSPAN_list_skills","LOOMSPAN_get_skill","LOOMSPAN_list_executions","LOOMSPAN_get_execution","LOOMSPAN_get_execution_activity","LOOMSPAN_list_traces","LOOMSPAN_get_trace","LOOMSPAN_query_trace_plans","LOOMSPAN_query_trace_frames","LOOMSPAN_query_trace_records","LOOMSPAN_read_trace_content","LOOMSPAN_read_trace_artifact"],"requiredFacts":["complete root-to-leaf branches","nullable nearest assignment","same-snapshot predicate","disabled and ungrouped work"],"requiredLimitations":["live facts are provisional","eligibility is not finalized overlap","canonical sequence is not causality"],"forbiddenClaims":["caused by concurrency","group name proves overlap"],"forbiddenActions":["shell","filesystem","browser"]}
