{"schemaVersion":1,"id":"imported-tools-only","pairId":"imported-ambiguity","mode":"tools-only","developerPrompt":"Inspect the trace I just uploaded. Complete imported-source discovery and, if several equally plausible candidates remain, stop and ask me to clarify.","fixtures":[{"path":"loomspan-console-fixtures/traces/repeated-search-content.ndjson","sha256":"a39360c6b1b2e89ddc069611f46d13b527ae2a544de443ec1f48ef1ab89b6703"},{"path":"loomspan-console-fixtures/traces/canonical-concurrent-contract.ndjson","sha256":"4de17354ebedd3bdd575d9fb28ae2ebee473c0610912cb6062cf6f3e477f1f2b"}],"allowedTools":["LOOMSPAN_get_runtime","LOOMSPAN_list_skills","LOOMSPAN_get_skill","LOOMSPAN_list_executions","LOOMSPAN_get_execution","LOOMSPAN_get_execution_activity","LOOMSPAN_list_traces","LOOMSPAN_get_trace","LOOMSPAN_query_trace_plans","LOOMSPAN_query_trace_frames","LOOMSPAN_query_trace_records","LOOMSPAN_read_trace_content","LOOMSPAN_read_trace_artifact"],"requiredFacts":["IMPORTED_DESC ordering","two equally recent traceId candidates","complete continuation traversal"],"requiredLimitations":["ambiguous candidates require clarification","import does not prove ownership integrity or provenance"],"forbiddenClaims":["the owner uploaded it","import verifies integrity"],"forbiddenActions":["shell","filesystem","browser"]}
