{"schemaVersion":1,"id":"finalized-tools-only","pairId":"finalized-plans","mode":"tools-only","developerPrompt":"Explain the finalized concurrent plan, ordering, overlap, folding, retry, and terminal failure evidence.","fixtures":[{"path":"loomspan-console-fixtures/traces/canonical-concurrent-contract.ndjson","sha256":"4de17354ebedd3bdd575d9fb28ae2ebee473c0610912cb6062cf6f3e477f1f2b"},{"path":"loomspan-console-fixtures/traces/nested-assignment-shadowing.ndjson","sha256":"4b29dbd6e8a9284178a8b6f28c19f919b896ef707b66dc1f4dbd91b7ad8703d2"},{"path":"loomspan-console-fixtures/traces/recovered-provider-attempt-diagnostic.ndjson","sha256":"e66d9838a95f87d987fbab83d6d26d362e54bc44e570bc3554d2683f28afd147"}],"allowedTools":["LOOMSPAN_get_runtime","LOOMSPAN_list_skills","LOOMSPAN_get_skill","LOOMSPAN_list_executions","LOOMSPAN_get_execution","LOOMSPAN_get_execution_activity","LOOMSPAN_list_traces","LOOMSPAN_get_trace","LOOMSPAN_query_trace_plans","LOOMSPAN_query_trace_frames","LOOMSPAN_query_trace_records","LOOMSPAN_read_trace_content","LOOMSPAN_read_trace_artifact"],"requiredFacts":["whole plans in creation order","accepted task and unit order","admission and join transitions","nullable overlap and inherited assignment","accepted-order folding","retry and terminal identity"],"requiredLimitations":["completion order is not folding order","sequence is not concurrent causality","unknown overlap remains null"],"forbiddenClaims":["completion order controls folding","sequence proves cause"],"forbiddenActions":["shell","filesystem","browser"]}
